{"body":"Files under `.ssot` MUST respect these limits:\n\n- Maximum relative path length: **240** characters.\n- Maximum filename length: **120** characters.\n\nValidation fails when either limit is exceeded.","decision_date":null,"id":"adr:0612","kind":"adr","number":612,"origin":"ssot-origin","references":[],"schema_version":"0.1.0","slug":"ssot-path-and-filename-length-limits","status":"draft","status_notes":[],"summary":"Files under `.ssot` MUST respect these limits:","superseded_by":[],"supersedes":[],"tags":[],"title":"Enforce max path and filename lengths under `.ssot`"}