{"body":"The only authored machine-readable source of truth is `.ssot/registry.json`.","decision_date":null,"id":"adr:0001","kind":"adr","number":1,"origin":"ssot-core","references":[],"schema_version":"0.1.0","slug":"canonical-json-registry","status":"draft","status_notes":[],"summary":"The only authored machine-readable source of truth is `.ssot/registry.json`.","superseded_by":[],"supersedes":[],"tags":[],"title":"Canonical registry is a single JSON document"}