{"body":"## Context\n\nThe registry needed an entity between atomic features and release boundaries:\n\n- features are independently targetable,\n- boundaries are release/freeze artifacts,\n- releases certify a boundary scope.\n\nTeams also need reusable capability bundles that can be composed and evaluated.\n\n## Decision\n\nIntroduce a first-class `profiles` entity:\n\n- profile rows bundle `feature_ids` and nested `profile_ids`,\n- profile pass/fail is computed (never stored),\n- feature pass still requires satisfying claims and guard checks,\n- boundary scope may include both direct `feature_ids` and `profile_ids`,\n- boundary feature scope is resolved dynamically at evaluation/reporting time.\n\nTier resolution is fail-closed:\n\n1. feature `plan.target_claim_tier`,\n2. profile `claim_tier`,\n3. no tier => failing evaluation.","decision_date":null,"id":"adr:0014","kind":"adr","number":14,"origin":"ssot-core","references":[],"schema_version":"0.1.0","slug":"profiles-as-reusable-feature-bundles","status":"accepted","status_notes":[],"summary":"The registry needed an entity between atomic features and release boundaries:","superseded_by":[],"supersedes":[],"tags":[],"title":"Profiles are reusable feature bundles with derived pass status"}