{"body":"Frozen boundaries and promoted/published releases emit immutable snapshots with hashes.","decision_date":null,"id":"adr:0008","kind":"adr","number":8,"origin":"ssot-core","references":[],"schema_version":"0.1.0","slug":"immutable-boundary-and-release-snapshots","status":"draft","status_notes":[],"summary":"Frozen boundaries and promoted/published releases emit immutable snapshots with hashes.","superseded_by":[],"supersedes":[],"tags":[],"title":"Immutable boundary and release snapshots"}