{"body":"Every first-class entity uses a normalized prefixed ID.","decision_date":null,"id":"adr:0604","kind":"adr","number":604,"origin":"ssot-origin","references":[],"schema_version":"0.1.0","slug":"normalized-prefixed-ids","status":"draft","status_notes":[],"summary":"Every first-class entity uses a normalized prefixed ID.","superseded_by":[],"supersedes":[],"tags":[],"title":"Normalized prefixed IDs"}