{"body":"`ssot-registry` SHALL remain the canonical implementation of:\n\n- validation semantics\n- guards\n- migrations\n- mutations\n- lifecycle and release behavior\n\nGenerated code and views SHALL not replace those semantics.","decision_date":null,"id":"adr:0503","kind":"adr","number":503,"origin":"ssot-core","references":[],"schema_version":"0.1.0","slug":"python-runtime-remains-canonical-behavior-engine","status":"draft","status_notes":[],"summary":"`ssot-registry` SHALL remain the canonical implementation of:","superseded_by":[],"supersedes":[],"tags":[],"title":"Python runtime remains the canonical behavior engine"}