{"body":"Migration support SHALL be represented as explicit source-to-target schema edges. Each known non-current schema_version SHALL have a callable migration implementation, a release-window label, and a test that proves the path reaches the current schema_version.","decision_date":null,"id":"adr:0510","kind":"adr","number":510,"origin":"ssot-core","references":[],"schema_version":"0.2.0","slug":"migration-paths","status":"accepted","status_notes":[],"summary":"Migration support SHALL be represented as explicit source-to-target schema edges. Each known non-current schema_version SHALL have a callable migration implementation, a release-window label, and a test that proves the path reaches the current schema_version.","superseded_by":[],"supersedes":[],"tags":[],"title":"Govern migration paths as explicit schema edges"}