{"body":"Features are the only targetable implementation units. There is no separate `targets[]` section.","decision_date":null,"id":"adr:0002","kind":"adr","number":2,"origin":"ssot-core","references":[],"schema_version":"0.1.0","slug":"features-are-targetable-units","status":"draft","status_notes":[],"summary":"Features are the only targetable implementation units. There is no separate `targets[]` section.","superseded_by":[],"supersedes":[],"tags":[],"title":"Features are the targetable units"}