{"body":"Breaking schema changes increment `schema_version` and require migration.","decision_date":null,"id":"adr:0011","kind":"adr","number":11,"origin":"ssot-core","references":[],"schema_version":"0.1.0","slug":"explicit-schema-versioning","status":"draft","status_notes":[],"summary":"Breaking schema changes increment `schema_version` and require migration.","superseded_by":[],"supersedes":[],"tags":[],"title":"Explicit schema versioning"}