{"body":"`ssot-contracts` is the only package that owns packaged JSON schema files.\n\n`ssot-core` consumes schema text through the `ssot_contracts` API and MUST NOT ship or maintain its own duplicate schema JSON tree.\n\nThis keeps schema authority in one package, avoids silent drift between package copies, and makes changes to schema logic flow through the contracts layer first.\n\nRepo-local `.ssot/schemas` copies remain acceptable as derived repository artifacts, but they are not the package-owned master copy.","decision_date":null,"id":"adr:0508","kind":"adr","number":508,"origin":"ssot-core","references":[],"schema_version":"0.1.0","slug":"ssot-contracts-is-the-sole-packaged-schema-authority","status":"draft","status_notes":[],"summary":"`ssot-contracts` is the only package that owns packaged JSON schema files.","superseded_by":[],"supersedes":[],"tags":[],"title":"ssot-contracts is the sole packaged schema authority"}