{"body":"Choose a single maximum length for normalized entity IDs and enforce it in shipped schemas rather than leaving length unconstrained.\n\nThe max length MUST apply to:\n\n- canonical registry entity `id` fields\n- entity reference fields such as `*_ids`, `boundary_id`, and active program ids\n- authored ADR and SPEC document ids\n\nA shared cap of **128 characters** is adopted because it is comfortably above current IDs while still bounding path growth in evidence, reports, and generated artifacts.\n\nValidation surfaces MUST reject overlong IDs during normal registry validation, and document schema validation MUST reject authored ADR/SPEC payloads that exceed the same limit.","decision_date":null,"id":"adr:0507","kind":"adr","number":507,"origin":"ssot-core","references":[],"schema_version":"0.1.0","slug":"schema-owned-max-length-for-normalized-ids","status":"draft","status_notes":[],"summary":"Choose a single maximum length for normalized entity IDs and enforce it in shipped schemas rather than leaving length unconstrained.","superseded_by":[],"supersedes":[],"tags":[],"title":"Schema-owned max length for normalized ids"}